{
  "schema_version": 1,
  "invocation_id": "223e4567-e89b-42d3-a456-426614174001",
  "operation_id": "run_01:document.render:001",
  "status": "succeeded",
  "output": {
    "page_count": 1
  },
  "artifacts": [
    {
      "path": "/output/document.pdf",
      "media_type": "application/pdf",
      "name": "document.pdf"
    }
  ]
}
