{
  "schema_version": 1,
  "invocation_id": "123e4567-e89b-42d3-a456-426614174000",
  "operation_id": "run_01:archive.extract:001",
  "status": "succeeded",
  "output": {
    "file_count": 1
  },
  "artifacts": [
    {
      "path": "/output/archive/readme.txt",
      "media_type": "text/plain",
      "name": "readme.txt"
    }
  ]
}
